{
  "id": "serpent-scale-mail",
  "name": "Serpent-Scale Mail",
  "source": "Circus System",
  "flavor": "Overlapping enameled scales that shimmer like a snake charmer's prize — protective, but they hiss and clink when you try to move unseen.",
  "category": "medium",
  "baseAC": 14,
  "maxDexBonus": 2,
  "stealthDisadvantage": true
}
