{
  "id": "ironmonger-chain-mail",
  "name": "Ironmonger's Chain Mail",
  "source": "Circus System",
  "flavor": "A heavy shirt of interlocking rings from the show's smith — dependable, weighty, and loud on a quiet night.",
  "category": "heavy",
  "baseAC": 16,
  "maxDexBonus": 0,
  "strengthRequirement": 13,
  "stealthDisadvantage": true
}
